<?xml version="1.0" encoding="UTF-8" standalone="no"?>
<!DOCTYPE game SYSTEM "game_grammar.dtd">
<game>
    <lobby>
        <player>
            <nickname>Riccardo</nickname>
            <god>PERSEPHONE</god>
            <pawns>
                <worker current="true" gender="male">
                    <x>1</x>
                    <y>2</y>
                </worker>
                <worker current="false" gender="female">
                    <x>4</x>
                    <y>1</y>
                </worker>
            </pawns>
        </player>
        <player>
            <nickname>Fabio</nickname>
            <god>ATHENA</god>
            <pawns>
                <worker current="true" gender="male">
                    <x>0</x>
                    <y>2</y>
                </worker>
                <worker current="false" gender="female">
                    <x>4</x>
                    <y>4</y>
                </worker>
            </pawns>
        </player>
        <player state="chooseWorker">
            <nickname>Mirko</nickname>
            <god>ZEUS</god>
            <pawns>
                <worker current="false" gender="male">
                    <x>0</x>
                    <y>0</y>
                </worker>
                <worker current="true" gender="female">
                    <x>0</x>
                    <y>1</y>
                </worker>
            </pawns>
            <malusList>
                <malus permanent="true">
                    <type>MOVE</type>
                    <forbidden>
                        <direction>UP</direction>
                    </forbidden>
                </malus>
                <malus permanent="false">
                    <type>BUILD</type>
                    <numTurn>5</numTurn>
                    <forbidden>
                        <direction>DOWN</direction>
                    </forbidden>
                </malus>
            </malusList>
        </player>
    </lobby>
    <board>
        <cell>
            <x>0</x>
            <y>0</y>
            <level>GROUND</level>
        </cell>
        <cell>
            <x>0</x>
            <y>1</y>
            <level>BOTTOM</level>
        </cell>
        <cell>
            <x>0</x>
            <y>2</y>
            <level>MIDDLE</level>
        </cell>
        <cell>
            <x>0</x>
            <y>3</y>
            <level>TOP</level>
        </cell>
        <cell>
            <x>0</x>
            <y>4</y>
            <level>DOME</level>
        </cell>
        <cell>
            <x>1</x>
            <y>0</y>
            <level>GROUND</level>
        </cell>
        <cell>
            <x>1</x>
            <y>1</y>
            <level>GROUND</level>
        </cell>
        <cell>
            <x>1</x>
            <y>2</y>
            <level>GROUND</level>
        </cell>
        <cell>
            <x>1</x>
            <y>3</y>
            <level>GROUND</level>
        </cell>
        <cell>
            <x>1</x>
            <y>4</y>
            <level>GROUND</level>
        </cell>
        <cell>
            <x>2</x>
            <y>0</y>
            <level>GROUND</level>
        </cell>
        <cell>
            <x>2</x>
            <y>1</y>
            <level>GROUND</level>
        </cell>
        <cell>
            <x>2</x>
            <y>2</y>
            <level>GROUND</level>
        </cell>
        <cell>
            <x>2</x>
            <y>3</y>
            <level>GROUND</level>
        </cell>
        <cell>
            <x>2</x>
            <y>4</y>
            <level>GROUND</level>
        </cell>
        <cell>
            <x>3</x>
            <y>0</y>
            <level>GROUND</level>
        </cell>
        <cell>
            <x>3</x>
            <y>1</y>
            <level>GROUND</level>
        </cell>
        <cell>
            <x>3</x>
            <y>2</y>
            <level>GROUND</level>
        </cell>
        <cell>
            <x>3</x>
            <y>3</y>
            <level>GROUND</level>
        </cell>
        <cell>
            <x>3</x>
            <y>4</y>
            <level>GROUND</level>
        </cell>
        <cell>
            <x>4</x>
            <y>0</y>
            <level>GROUND</level>
        </cell>
        <cell>
            <x>4</x>
            <y>1</y>
            <level>GROUND</level>
        </cell>
        <cell>
            <x>4</x>
            <y>2</y>
            <level>GROUND</level>
        </cell>
        <cell>
            <x>4</x>
            <y>3</y>
            <level>GROUND</level>
        </cell>
        <cell>
            <x>4</x>
            <y>4</y>
            <level>GROUND</level>
        </cell>
    </board>
</game>
