<?xml version="1.0" encoding="UTF-8" standalone="no"?>
<!DOCTYPE game SYSTEM "game_grammar.dtd">
<game>
    <lobby>
        <player state="move">
            <nickname>ejkcjs</nickname>
            <god>ARTEMIS</god>
            <pawns>
                <worker current="false" gender="male">
                    <x>1</x>
                    <y>1</y>
                </worker>
                <worker current="true" gender="female">
                    <x>2</x>
                    <y>1</y>
                </worker>
            </pawns>
        </player>
        <player>
            <nickname>edvcwe</nickname>
            <god>APOLLO</god>
            <pawns>
                <worker current="true" gender="male">
                    <x>2</x>
                    <y>2</y>
                </worker>
                <worker current="false" gender="female">
                    <x>3</x>
                    <y>2</y>
                </worker>
            </pawns>
        </player>
    </lobby>
    <board>
        <cell>
            <x>0</x>
            <y>0</y>
            <level>GROUND</level>
        </cell>
        <cell>
            <x>0</x>
            <y>1</y>
            <level>GROUND</level>
        </cell>
        <cell>
            <x>0</x>
            <y>2</y>
            <level>GROUND</level>
        </cell>
        <cell>
            <x>0</x>
            <y>3</y>
            <level>GROUND</level>
        </cell>
        <cell>
            <x>0</x>
            <y>4</y>
            <level>GROUND</level>
        </cell>
        <cell>
            <x>1</x>
            <y>0</y>
            <level>GROUND</level>
        </cell>
        <cell>
            <x>1</x>
            <y>1</y>
            <level>GROUND</level>
        </cell>
        <cell>
            <x>1</x>
            <y>2</y>
            <level>GROUND</level>
        </cell>
        <cell>
            <x>1</x>
            <y>3</y>
            <level>GROUND</level>
        </cell>
        <cell>
            <x>1</x>
            <y>4</y>
            <level>GROUND</level>
        </cell>
        <cell>
            <x>2</x>
            <y>0</y>
            <level>GROUND</level>
        </cell>
        <cell>
            <x>2</x>
            <y>1</y>
            <level>GROUND</level>
        </cell>
        <cell>
            <x>2</x>
            <y>2</y>
            <level>GROUND</level>
        </cell>
        <cell>
            <x>2</x>
            <y>3</y>
            <level>GROUND</level>
        </cell>
        <cell>
            <x>2</x>
            <y>4</y>
            <level>GROUND</level>
        </cell>
        <cell>
            <x>3</x>
            <y>0</y>
            <level>GROUND</level>
        </cell>
        <cell>
            <x>3</x>
            <y>1</y>
            <level>GROUND</level>
        </cell>
        <cell>
            <x>3</x>
            <y>2</y>
            <level>GROUND</level>
        </cell>
        <cell>
            <x>3</x>
            <y>3</y>
            <level>GROUND</level>
        </cell>
        <cell>
            <x>3</x>
            <y>4</y>
            <level>GROUND</level>
        </cell>
        <cell>
            <x>4</x>
            <y>0</y>
            <level>GROUND</level>
        </cell>
        <cell>
            <x>4</x>
            <y>1</y>
            <level>GROUND</level>
        </cell>
        <cell>
            <x>4</x>
            <y>2</y>
            <level>GROUND</level>
        </cell>
        <cell>
            <x>4</x>
            <y>3</y>
            <level>GROUND</level>
        </cell>
        <cell>
            <x>4</x>
            <y>4</y>
            <level>GROUND</level>
        </cell>
    </board>
</game>
