<?xml version="1.0" encoding="UTF-8" ?>
<!DOCTYPE game SYSTEM
        "/Users/mirkousuelli/OneDrive - Politecnico di Milano/GitHub/SW-Engineering-Project/mirko/ing-sw-2020-secreti-tresoldi-usuelli/src/main/java/it/polimi/ingsw/server/model/storage/xml/game_grammar.dtd">

<game>

    <lobby id="RFM1">
        <player>
            <nickname>Riccardo</nickname>
            <god>APOLLO</god>
        </player>
        <player>
            <nickname>Fabio</nickname>
            <god>ZEUS</god>
        </player>
        <player>
            <nickname>Mirko</nickname>
            <god>HEPHAESTUS</god>
        </player>
    </lobby>

    <turn>
        <player>
            <nickname>Mirko</nickname>
        </player>
        <state>CHOOSE_WORKER</state>
    </turn>

    <board>
        <cell>
            <x>0</x>
            <y>0</y>
            <level>GROUND</level>
            <worker gender="male">
                <player>
                    <nickname>Mirko</nickname>
                </player>
            </worker>
        </cell>
        <cell>
            <x>0</x>
            <y>1</y>
            <level>GROUND</level>
            <worker gender="female">
                <player>
                    <nickname>Mirko</nickname>
                </player>
            </worker>
        </cell>
        <cell>
            <x>0</x>
            <y>2</y>
            <level>GROUND</level>
            <worker gender="female">
                <player>
                    <nickname>Fabio</nickname>
                </player>
            </worker>
        </cell>
        <cell>
            <x>0</x>
            <y>3</y>
            <level>GROUND</level>
        </cell>
        <cell>
            <x>0</x>
            <y>4</y>
            <level>GROUND</level>
        </cell>
        <cell>
            <x>1</x>
            <y>0</y>
            <level>GROUND</level>
        </cell>
        <cell>
            <x>1</x>
            <y>1</y>
            <level>GROUND</level>
        </cell>
        <cell>
            <x>1</x>
            <y>2</y>
            <level>GROUND</level>
            <worker gender="male">
                <player>
                    <nickname>Riccardo</nickname>
                </player>
            </worker>
        </cell>
        <cell>
            <x>1</x>
            <y>3</y>
            <level>GROUND</level>
        </cell>
        <cell>
            <x>1</x>
            <y>4</y>
            <level>GROUND</level>
        </cell>
        <cell>
            <x>2</x>
            <y>0</y>
            <level>GROUND</level>
        </cell>
        <cell>
            <x>2</x>
            <y>1</y>
            <level>GROUND</level>
        </cell>
        <cell>
            <x>2</x>
            <y>2</y>
            <level>GROUND</level>
        </cell>
        <cell>
            <x>2</x>
            <y>3</y>
            <level>GROUND</level>
        </cell>
        <cell>
            <x>2</x>
            <y>4</y>
            <level>GROUND</level>
        </cell>
        <cell>
            <x>3</x>
            <y>0</y>
            <level>GROUND</level>
        </cell>
        <cell>
            <x>3</x>
            <y>1</y>
            <level>GROUND</level>
        </cell>
        <cell>
            <x>3</x>
            <y>2</y>
            <level>GROUND</level>
        </cell>
        <cell>
            <x>3</x>
            <y>3</y>
            <level>GROUND</level>
        </cell>
        <cell>
            <x>3</x>
            <y>4</y>
            <level>GROUND</level>
        </cell>
        <cell>
            <x>4</x>
            <y>0</y>
            <level>GROUND</level>
        </cell>
        <cell>
            <x>4</x>
            <y>1</y>
            <level>GROUND</level>
            <worker gender="female">
                <player>
                    <nickname>Riccardo</nickname>
                </player>
            </worker>
        </cell>
        <cell>
            <x>4</x>
            <y>2</y>
            <level>GROUND</level>
        </cell>
        <cell>
            <x>4</x>
            <y>3</y>
            <level>GROUND</level>
        </cell>
        <cell>
            <x>4</x>
            <y>4</y>
            <level>GROUND</level>
            <worker gender="male">
                <player>
                    <nickname>Fabio</nickname>
                </player>
            </worker>
        </cell>
    </board>

</game>